<?xml version="1.0" encoding="UTF-8"?>
<!DOCTYPE theme PUBLIC "wa-app-theme" "http://www.webasyst.com/wa-content/xml/wa-app-theme.dtd">
<theme id="vk" system="0" vendor="webasyst" author="Webasyst" app="site" version="1.1.29">
    <name locale="en_US">VK</name>
    <name locale="ru_RU">Вконтакте</name>
    <description locale="ru_RU">Ваш сайт во «Вконтакте» в виде Iframe-приложения.</description>
    <files>
        <file path="index.html" custom="0">
            <description locale="en_US">Core layout of the VK theme family</description>
            <description locale="ru_RU">Основной макет тем дизайна семейства VK</description>
        </file>
        <file path="vk.css" custom="0">
            <description locale="en_US">Core CSS of the VK theme family</description>
            <description locale="ru_RU">Основной файл CSS-стилей семейства тем дизайна VK</description>
        </file>
        <file path="vk.js" custom="0">
            <description locale="en_US">JS</description>
            <description locale="ru_RU">JS</description>
        </file>
        <file path="content.html" custom="0">
            <description locale="en_US">Main layout for the Site app content</description>
            <description locale="ru_RU">Основной вывод приложения «Сайт»</description>
        </file>
        <file path="head.html" custom="0">
            <description locale="en_US">Site app's &lt;head&gt; instructions</description>
            <description locale="ru_RU">Блок &lt;head&gt; приложения «Сайт»</description>
        </file>
        <file path="footer.html" custom="0">
            <description locale="en_US">App specific footer content</description>
            <description locale="ru_RU">Содержимое футера приложения</description>
        </file>
        <file path="searchform.html" custom="0">
            <description locale="en_US">Internal app search form</description>
            <description locale="ru_RU">Форма поиска в приложении</description>
        </file>
        <file path="page.html" custom="0">
            <description locale="en_US">Static page content and navigation</description>
            <description locale="ru_RU">Содержимое открытой страницы и навигация по страницам</description>
        </file>
        <file path="login.html" custom="0">
            <description locale="en_US">Login page</description>
            <description locale="ru_RU">Страница входа для пользователей</description>
        </file>
        <file path="signup.html" custom="0">
            <description locale="en_US">Sign up page</description>
            <description locale="ru_RU">Страница регистрации пользователей</description>
        </file>
        <file path="forgotpassword.html" custom="0">
            <description locale="en_US">Forgot password page</description>
            <description locale="ru_RU">Страница сброса пароля</description>
        </file>
        <file path="my.profile.html">
            <description locale="en_US">My profile: contact info editing form</description>
            <description locale="ru_RU">Мой профиль: редактирование контактной информации</description>
        </file>
        <file path="my.nav.html">
            <description locale="en_US">My profile navigation</description>
            <description locale="ru_RU">Навигационное меню внутри личного кабинета</description>
        </file>
        <file path="error.html" custom="0">
            <description locale="en_US">404 and other errors</description>
            <description locale="ru_RU">404 и другие ошибки</description>
        </file>
    </files>
    <about locale="en_US">
        <![CDATA[
<p><b>VK</b> design themes are designed for embedding Webasyst-powered websites into <a href="http://vk.com">VK.com</a> social network as iframe apps. VK theme family is universal — there is a theme for every basic Webasyst app: Site, Blog, Photos, Shop-Script, etc. The parent (main) theme of the family, which includes the basic set of CSS rules and the common layout template index.html, is the VK (i.e. this) theme for the Site application. All VK design themes for other apps (e.g., Blog or Photos) link common CSS and index.html layout file from the main (i.e. this) theme.</p>
]]>
    </about>
    <about locale="ru_RU">
        <![CDATA[
<p>Темы <b>VK</b> разработаны для внедрения сайтов, созданных на основе фреймворка Вебасист, в соцсеть «<a href="http://vk.com">Вконтакте</a>» в виде iframe-приложений. Семейство тем VK универсальное — подходит для всех базовых приложений фреймворка Вебасист: Сайт, Блог, Фото, Shop-Script и других. Родительской (основной) темой семейства, включающей в себя базовый набор CSS-стилей и общий макет дизайна index.html, является тема для приложения «Сайт» (данная тема). Все темы VK для других приложений (Блог, Фото и других) используют базовый CSS и index.html из родительской (основной) темы.</p>
]]>
    </about>
    <settings>
        <setting var="vk_app_id" control_type="text">
            <value>YOUR_VK_APP_ID</value>
            <name locale="en_US">VK App ID</name>
            <name locale="ru_RU">ID приложения «Вконтакте»</name>
            <description locale="en_US"></description>
            <description locale="ru_RU"><![CDATA[Для встраивания сайта в соцсеть в виде приложения необходимо создать приложение для «Вконтакте». Инструкция: <a href="http://www.webasyst.ru/help/27/shop-script-5-vkontakte-online-store/" target="_blank">http://www.webasyst.ru/help/27/shop-script-5-vkontakte-online-store/</a>]]></description>
        </setting>
        <setting var="vk_app_secret" control_type="text">
            <value>YOUR_VK_APP_SECRET</value>
            <name locale="en_US">VK App Secret</name>
            <name locale="ru_RU">Защищенный ключ приложения «Вконтакте»</name>
            <description locale="en_US"></description>
            <description locale="ru_RU"><![CDATA[Для встраивания сайта в соцсеть в виде приложения необходимо создать приложение для «Вконтакте». Инструкция: <a href="http://www.webasyst.ru/help/27/shop-script-5-vkontakte-online-store/" target="_blank">http://www.webasyst.ru/help/27/shop-script-5-vkontakte-online-store/</a>]]></description>
        </setting>
        <setting var="footer_notice" control_type="text">
            <value></value>
            <name locale="en_US">Footer notice</name>
            <name locale="ru_RU">Уведомление в подвале сайта</name>
        </setting>
    </settings>
</theme>