<?xml version="1.0" encoding="UTF-8"?>
<!DOCTYPE theme PUBLIC "wa-app-theme" "http://www.webasyst.com/wa-content/xml/wa-app-theme.dtd">
<theme id="default" system="0" vendor="webasyst" author="Webasyst" app="photos" parent_theme_id="site:default" version="4.0.0">
    <name locale="en_US">Default 4.0</name>
    <name locale="ru_RU">Дефолт 4.0</name>
    <description locale="ru_RU">Семейство адаптивных тем дизайна.</description>
    <files>
        <file path="index.html" parent="1">
        </file>
        <file path="default.css" parent="1">
        </file>
        <file path="default.photos.css">
        </file>
        <file path="default.photos.js">
        </file>
        <file path="head.html">
            <description locale="en_US">Photos app's &lt;head&gt; instructions</description>
            <description locale="ru_RU">Блок &lt;head&gt; приложения «Фото»</description>
        </file>
        <file path="header.html">
            <description locale="en_US">App specific header content</description>
            <description locale="ru_RU">Содержимое «шапки» приложения</description>
        </file>
        <file path="main.html">
            <description locale="en_US">Main layout and navigation for the Photos app content</description>
            <description locale="ru_RU">Основной макет вывода содержимого и навигации в приложении «Фото»</description>
        </file>
        <file path="footer.html">
            <description locale="en_US">App specific footer content</description>
            <description locale="ru_RU">Содержимое футера приложения</description>
        </file>
        <file path="photos-thumbs.html">
            <description locale="en_US">Photo list thumbnails view</description>
            <description locale="ru_RU">Список фотографий эскизами</description>
        </file>
        <file path="photos-plain.html">
            <description locale="en_US">Photo list plain view</description>
            <description locale="ru_RU">Список фотографий «простыней»</description>
        </file>
        <file path="photo.html">
            <description locale="en_US">One photo and its details</description>
            <description locale="ru_RU">Просмотр фотографий по одной</description>
        </file>
        <file path="home.html">
            <description locale="en_US">Wrapper for the main photo gallery homepage</description>
            <description locale="ru_RU">Обертка для главной страницы фотогалереи</description>
        </file>
        <file path="album.html">
            <description locale="en_US">Wrapper for photo album</description>
            <description locale="ru_RU">Обертка для альбома фотографий</description>
        </file>
        <file path="search.html">
            <description locale="en_US">Wrapper for photo search (filtering) results, e.g. by tag or by rating</description>
            <description locale="ru_RU">Обертка для страницы поиска (фильтрации) фотографий, например, по тегу или автору</description>
        </file>
        <file path="page.html">
            <description locale="en_US">Static page content</description>
            <description locale="ru_RU">Содержимое информационной страницы</description>
        </file>
        <file path="my.nav.html">
            <description locale="en_US">Customer account navigation menu</description>
            <description locale="ru_RU">Меню навигации в личном кабинете покупателя</description>
        </file>
        <file path="login.html" parent="1">
        </file>
        <file path="signup.html" parent="1">
        </file>
        <file path="forgotpassword.html" parent="1">
        </file>
        <file path="my.profile.html" parent="1">
        </file>
        <file path="error.html" parent="1">
        </file>
        <file path="default.js" parent="1">
        </file>
    </files>
    <about locale="en_US">
<![CDATA[
<p><b>Default</b> is a universal adaptive design theme family for all basic Webasyst apps: Site, Blog, Photos, Shop-Script, and others. The parent (main) theme of the family, which includes the basic set of CSS rules and the common layout template index.html, is the Default theme for the Site application. All Default design themes used in other applications (e.g., Blog or Photos) link common CSS and index.html layout file from the main theme.</p>
<p>Default design themes automatically link CSS depending on a visitor's device. Supported devices and platforms: iOS or Android based mobile devices, tablet computers such as iPad, common desktop computers and laptops.</p>
]]>
    </about>
    <about locale="ru_RU">
<![CDATA[
<p><b>Default</b> — это универсальное семейство адаптивных тем дизайна для всех базовых приложений фреймворка Вебасист: Сайт, Блог, Фото, Shop-Script и других. Родительской (основной) темой семейства, включающей в себя базовый набор CSS-стилей и общий макет дизайна index.html, является тема Default для приложения «Сайт» (данная тема). Все темы дизайна Default для других приложений (Блог, Фото и других) используют базовый CSS и index.html из родительской (основной) темы.</p>
<p>Темы дизайна семейства Default оптимизированы для всех современных браузеров, планшетных компьютеров и мобильных устройств на основе iOS и Android. CSS-стили подключаются в зависимости от разрешения и типа устройства, которым пользуется посетитель сайта.</p>
]]>
    </about>
    <thumbs>
        <thumb>200x0</thumb>
        <thumb>970x0</thumb>
    </thumbs>
</theme>
