<?xml version="1.0" encoding="UTF-8"?>
<!DOCTYPE theme PUBLIC "wa-app-theme" "http://www.webasyst.com/wa-content/xml/wa-app-theme.dtd" >
<theme id="my-theme" system="0" vendor="webasyst" author="Webasyst" app="my-app" version="1.0.0">
	<name locale="en_US"><![CDATA[Theme name]]></name>
	<name locale="ru_RU"><![CDATA[Название темы]]></name>
	<description locale="en_US"><![CDATA[Theme name description]]></description>
	<description locale="ru_RU"><![CDATA[Описание "название темы"]]></description>
	<files>
		<file path="index.html" custom="0">
			<description locale="en_US"><![CDATA[Primary file]]></description>
			<description locale="ru_RU"><![CDATA[Основной файл]]></description>
		</file>
	</files>
</theme>
