<?xml version="1.0" encoding="UTF-8"?>
<!DOCTYPE theme PUBLIC "wa-app-theme" "http://www.webasyst.com/wa-content/xml/wa-app-theme.dtd">
<theme id="nifty" system="0" vendor="webasyst" author="Webasyst" app="site" version="1.2.17">
    <name locale="en_US">Nifty</name>
    <name locale="ru_RU">Nifty</name>
    <description locale="ru_RU">Семейство адаптивных тем дизайна.</description>
    <files>
        <file path="index.html" custom="0">
            <description locale="en_US">Core layout of the Nifty theme family</description>
            <description locale="ru_RU">Основной макет тем дизайна семейства Nifty</description>
        </file>
        <file path="nifty.css" custom="0">
            <description locale="en_US">Core CSS of the Nifty theme family</description>
            <description locale="ru_RU">Основной файл CSS-стилей семейства тем дизайна Nifty</description>
        </file>
        <file path="nifty.js" custom="0">
            <description locale="en_US">JS</description>
            <description locale="ru_RU">JS</description>
        </file>
        <file path="content.html" custom="0">
            <description locale="en_US">Main layout for the Site app content</description>
            <description locale="ru_RU">Основной вывод приложения «Сайт»</description>
        </file>
        <file path="head.html" custom="0">
            <description locale="en_US">Site app's &lt;head&gt; instructions</description>
            <description locale="ru_RU">Блок &lt;head&gt; приложения «Сайт»</description>
        </file>
        <file path="footer.html" custom="0">
            <description locale="en_US">App specific footer content</description>
            <description locale="ru_RU">Содержимое футера приложения</description>
        </file>
        <file path="page.html" custom="0">
            <description locale="en_US">Static page content and navigation</description>
            <description locale="ru_RU">Содержимое открытой страницы и навигация по страницам</description>
        </file>
        <file path="login.html" custom="0">
            <description locale="en_US">Login page</description>
            <description locale="ru_RU">Страница входа для пользователей</description>
        </file>
        <file path="signup.html" custom="0">
            <description locale="en_US">Sign up page</description>
            <description locale="ru_RU">Страница регистрации пользователей</description>
        </file>
        <file path="forgotpassword.html" custom="0">
            <description locale="en_US">Forgot password page</description>
            <description locale="ru_RU">Страница сброса пароля</description>
        </file>
        <file path="my.profile.html">
            <description locale="en_US">My profile: contact info editing form</description>
            <description locale="ru_RU">Мой профиль: редактирование контактной информации</description>
        </file>
        <file path="my.nav.html">
            <description locale="en_US">My profile navigation</description>
            <description locale="ru_RU">Навигационное меню внутри личного кабинета</description>
        </file>
        <file path="error.html" custom="0">
            <description locale="en_US">404 and other errors</description>
            <description locale="ru_RU">404 и другие ошибки</description>
        </file>
        <file path="navigation.html" custom="0">
            <description locale="en_US">Internal storefront navigation</description>
            <description locale="ru_RU">Внутренняя навигация по витрине магазина</description>
        </file>
    </files>
    <about locale="en_US">
        <![CDATA[
<p><b>Nifty</b> is a universal adaptive design theme family for all basic Webasyst apps: Site, Blog, Photos, Shop-Script, and others. The parent (main) theme of the family, which includes the basic set of CSS rules and the common layout template index.html, is the Nifty (i.e. this) theme for the Site application. All Nifty design themes used in other applications (e.g., Blog or Photos) link common CSS and index.html layout file from the main (i.e. this) theme.</p>
<p>Nifty design themes automatically link CSS depending on a visitor's device. Supported devices and platforms: iOS or Android based mobile devices, tablet computers such as iPad, common desktop computers and laptops.</p>
]]>
    </about>
    <about locale="ru_RU">
        <![CDATA[
<p><b>Nifty</b> — это универсальное семейство адаптивных тем дизайна для всех базовых приложений фреймворка Вебасист: Сайт, Блог, Фото, Shop-Script и других. Родительской (основной) темой семейства, включающей в себя базовый набор CSS-стилей и общий макет дизайна index.html, является тема Nifty для приложения «Сайт» (данная тема). Все темы дизайна Nifty для других приложений (Блог, Фото и других) используют базовый CSS и index.html из родительской (основной) темы.</p>
<p>Темы дизайна семейства Nifty оптимизированы для всех современных браузеров, планшетных компьютеров и мобильных устройств на основе iOS и Android. CSS-стили подключаются в зависимости от разрешения и типа устройства, которым пользуется посетитель сайта.</p>
]]>
    </about>
    <settings>
        <setting var="color_scheme" control_type="select">
            <value>purple</value>
            <name locale="ru_RU">Цветовая гамма</name>
            <name locale="en_US">Color scheme</name>
            <options>
                <option value="purple">
                    <name locale="ru_RU">Фиолетовая</name>
                    <name locale="en_US">Purple</name>
                </option>
                <option value="green">
                    <name locale="ru_RU">Зеленая</name>
                    <name locale="en_US">Green</name>
                </option>
                <option value="blue">
                    <name locale="ru_RU">Синяя</name>
                    <name locale="en_US">Blue</name>
                </option>
                <option value="red">
                    <name locale="ru_RU">Красная</name>
                    <name locale="en_US">Red</name>
                </option>
                <option value="yellow">
                    <name locale="ru_RU">Желтая</name>
                    <name locale="en_US">Yellow</name>
                </option>
                <option value="white">
                    <name locale="ru_RU">Белая</name>
                    <name locale="en_US">White</name>
                </option>
                <option value="black">
                    <name locale="ru_RU">Черная</name>
                    <name locale="en_US">Black</name>
                </option>
            </options>
        </setting>
        <setting var="facebook_url" control_type="text">
            <value>#</value>
            <name locale="en_US">Facebook Page URL</name>
            <name locale="ru_RU">Адрес страницы в Фейсбуке</name>
        </setting>
        <setting var="twitter_url" control_type="text">
            <value>#</value>
            <name locale="en_US">Twitter URL</name>
            <name locale="ru_RU">Адрес страницы на Твиттере</name>
        </setting>
        <setting var="ajax_filters" control_type="checkbox">
            <value>1</value>
            <name locale="en_US">AJAX-enabled product by-feature filtering</name>
            <name locale="ru_RU">AJAX-фильтры товаров по характеристикам</name>
        </setting>
        <setting var="footer_notice" control_type="text">
            <value></value>
            <name locale="en_US">Footer notice</name>
            <name locale="ru_RU">Уведомление в подвале сайта</name>
        </setting>
        <setting var="use_shop_schedule" control_type="checkbox">
            <value>1</value>
            <name locale="ru_RU">Показывать график работы магазина на текущую неделю из настроек Shop-Script</name>
            <name locale="en_US">Show online store’s working schedule for current week from Shop-Script settings</name>
            <description locale="ru_RU">При включении игнорируется настройка «Сокращенный график работы».</description>
            <description locale="en_US">When enabled, “Brief working schedule” setting is ignored.</description>
        </setting>
        <setting var="manual_schedule" control_type="text">
            <value></value>
            <name locale="ru_RU">Сокращенный график работы</name>
            <name locale="en_US">Brief working schedule</name>
            <description locale="ru_RU">Например: Пн—Сб 08:00–18:00</description>
            <description locale="en_US">Example: Mo—Sa 08:00–18:00</description>
        </setting>
    </settings>
</theme>