<?xml version="1.0" encoding="UTF-8"?>
<!DOCTYPE theme PUBLIC "wa-app-theme" "http://www.webasyst.com/wa-content/xml/wa-app-theme.dtd">
<theme id="default" system="0" vendor="webasyst" author="Webasyst" app="blog" parent_theme_id="site:default" version="26.1">
    <name locale="en_US">Webasyst 2026</name>
    <name locale="ru_RU">Webasyst 2026</name>
    <files>
        <file path="index.html" parent="1">
        </file>
        <file path="default.css" parent="1">
        </file>
        <file path="default.blog.js">
        </file>
        <file path="default.blog.css">
        </file>
        <file path="head.html">
            <description locale="en_US">Blog app's &lt;head&gt; instructions</description>
            <description locale="ru_RU">Блок &lt;head&gt; приложения «Блог»</description>
        </file>
        <file path="header.html">
            <description locale="en_US">App specific header content</description>
            <description locale="ru_RU">Содержимое «шапки» приложения</description>
        </file>
        <file path="banner.html">
            <description locale="en_US">App specific banner content</description>
            <description locale="ru_RU">Контент в области баннера</description>
        </file>
        <file path="main.html">
            <description locale="en_US">Main layout and navigation for the Blog app content</description>
            <description locale="ru_RU">Основной макет вывода содержимого и навигации в приложении «Блог»</description>
        </file>
        <file path="footer.html">
            <description locale="en_US">App specific footer content</description>
            <description locale="ru_RU">Содержимое футера приложения</description>
        </file>
        <file path="stream.html">
            <description locale="en_US">Post stream wrapper</description>
            <description locale="ru_RU">Обертка для страницы вывода списка записей</description>
        </file>
        <file path="stream_search.html">
            <description locale="en_US">Post search (filtering) results, e.g. custom search, by tag, by author</description>
            <description locale="ru_RU">Результат поиска (фильтрации) записей, например, по тегу или автору</description>
        </file>
        <file path="stream_posts.html">
            <description locale="en_US">Default post list view mode</description>
            <description locale="ru_RU">Основной вид списка записей блога</description>
        </file>
        <file path="post.html">
            <description locale="en_US">Dedicated post page</description>
            <description locale="ru_RU">Страница одной записи блога</description>
        </file>
        <file path="post.album.html">
            <description locale="en_US">Photo album attached to the blog post</description>
            <description locale="ru_RU">Фотоальбом, прикрепленный к записи в блоге</description>
        </file>
        <file path="page.html">
            <description locale="en_US">Static info page</description>
            <description locale="ru_RU">Информационная страница</description>
        </file>
        <file path="comments.html">
            <description locale="en_US">Post comment list</description>
            <description locale="ru_RU">Комментарии к записи блога</description>
        </file>
        <file path="comment.html">
            <description locale="en_US">One comment template</description>
            <description locale="ru_RU">Вывод одного комментария из списка</description>
        </file>
        <file path="my.nav.html">
            <description locale="en_US">Customer account navigation menu</description>
            <description locale="ru_RU">Меню навигации в личном кабинете покупателя</description>
        </file>
        <file path="login.html" parent="1">
        </file>
        <file path="signup.html" parent="1">
        </file>
        <file path="forgotpassword.html" parent="1">
        </file>
        <file path="my.profile.html" parent="1">
        </file>
        <file path="error.html" parent="1">
        </file>
        <file path="default.js" parent="1">
        </file>
    </files>
    <about locale="en_US">
<![CDATA[
<p><b>Default</b> is a universal adaptive design theme family for all basic Webasyst apps: Site, Blog, Photos, Shop-Script, and others. The parent (main) theme of the family, which includes the basic set of CSS rules and the common layout template index.html, is the Default theme for the Site application. All Default design themes used in other applications (e.g., Blog or Photos) link common CSS and index.html layout file from the main theme.</p>
<p>Default design themes automatically link CSS depending on a visitor's device. Supported devices and platforms: iOS or Android based mobile devices, tablet computers such as iPad, common desktop computers and laptops.</p>
]]>
    </about>
    <about locale="ru_RU">
<![CDATA[
<p><b>Default</b> — это универсальное семейство адаптивных тем дизайна для всех базовых приложений фреймворка Вебасист: Сайт, Блог, Фото, Shop-Script и других. Родительской (основной) темой семейства, включающей в себя базовый набор CSS-стилей и общий макет дизайна index.html, является тема Default для приложения «Сайт» (данная тема). Все темы дизайна Default для других приложений (Блог, Фото и других) используют базовый CSS и index.html из родительской (основной) темы.</p>
<p>Темы дизайна семейства Default оптимизированы для всех современных браузеров, планшетных компьютеров и мобильных устройств на основе iOS и Android. CSS-стили подключаются в зависимости от разрешения и типа устройства, которым пользуется посетитель сайта.</p>
]]>
    </about>
</theme>
