<?xml version="1.0" encoding="UTF-8"?>
<!DOCTYPE theme PUBLIC "wa-app-theme" "http://www.webasyst.com/wa-content/xml/wa-app-theme.dtd">
<theme id="facebook" system="0" vendor="webasyst" author="Webasyst" app="blog" parent_theme_id="site:facebook" version="1.1.3">
    <name locale="en_US">Facebook</name>
    <name locale="ru_RU">Facebook</name>
    <files>
        <file path="facebook.blog.css" custom="0">
            <description locale="en_US">Core Blog app CSS</description>
            <description locale="ru_RU">Основной CSS приложения «Блог»</description>
        </file>      
        <file path="content.html" custom="0">
            <description locale="en_US">Main layout and navigation for the Blog app content</description>
            <description locale="ru_RU">Основное макет вывода содержимого и навигации в приложении «Блог»</description>
        </file>
        <file path="head.html" custom="0">
            <description locale="en_US">Blog app's &lt;head&gt; instructions</description>
            <description locale="en_US">Блок &lt;head&gt; приложения «Блог»</description>
        </file>
        <file path="stream.html" custom="0">
            <description locale="en_US">Post stream wrapper</description>
            <description locale="ru_RU">Обертка для страницы вывода списка записей</description>
        </file>
        <file path="stream_search.html" custom="0">
            <description locale="en_US">Post search (filtering) results, e.g. custom search, by tag, by author</description>
            <description locale="ru_RU">Результат поиска (фильтрации) записей, например, по тегу или автору</description>
        </file>
        <file path="stream_posts.html" custom="0">
            <description locale="en_US">Default post list view mode</description>
            <description locale="ru_RU">Основной вид списка записей блога</description>
        </file>
        <file path="post.html" custom="0">
            <description locale="en_US">Dedicated post page</description>
            <description locale="ru_RU">Страница одной записи блога</description>
        </file>
        <file path="page.html" custom="0">
            <description locale="en_US">Static info page</description>
            <description locale="ru_RU">Информационная страница</description>
        </file>
        <file path="comments.html" custom="0">
            <description locale="en_US">Post comment list</description>
            <description locale="ru_RU">Комментарии к записи блога</description>
        </file>
        <file path="comment.html" custom="0">
            <description locale="en_US">One comment template</description>
            <description locale="ru_RU">Вывод одного комментария из списка</description>
        </file>
        <file path="my.nav.html">
            <description locale="en_US">Customer account navigation menu</description>
            <description locale="ru_RU">Меню навигации в личном кабинете покупателя</description>
        </file>
        <file path="login.html" parent="1">
        </file>
        <file path="signup.html" parent="1">
        </file>
        <file path="forgotpassword.html" parent="1">
        </file>
        <file path="my.profile.html" parent="1">
        </file>
        <file path="error.html" parent="1">
        </file>
        <file path="navigation.html" custom="0">
            <description locale="en_US">Internal app navigation</description>
            <description locale="ru_RU">Внутренняя навигация приложения</description>
        </file>
        <file path="footer.html" custom="0">
            <description locale="en_US">App specific footer content</description>
            <description locale="ru_RU">Содержимое футера приложения</description>
        </file>
        <file path="searchform.html" custom="0">
            <description locale="en_US">Internal app search form</description>
            <description locale="ru_RU">Форма поиска в приложении</description>
        </file>
        <file path="index.html" custom="0" parent="1">
        </file>
        <file path="facebook.css" custom="0" parent="1">
        </file>
        <file path="facebook.js" custom="0" parent="1">
        </file>
        <file path="facebook.blog.js" custom="0">
            <description locale="en_US">JS</description>
            <description locale="ru_RU">JS</description>
        </file>
    </files>
    <about locale="en_US">
<![CDATA[
<p><b>Facebook</b> design themes are designed for embedding Webasyst-powered websites into <a href="http://www.facebook.com">Facebook</a> social network as iframe apps. Facebook theme family is universal — there is a theme for every basic Webasyst app: Site, Blog, Photos, Shop-Script, etc. The parent (main) theme of the family, which includes the basic set of CSS rules and the common layout template index.html, is the Facebook theme for the Site application. All Facebook design themes for other apps (e.g., Blog or Photos) link common CSS and index.html layout file from the main theme.</p>
]]>
    </about>
    <about locale="ru_RU">
<![CDATA[
<p>Темы <b>Facebook</b> разработаны для внедрения сайтов, созданных на основе фреймворка Вебасист, в «<a href="http://www.facebook.com">Фейсбук</a>» в виде iframe-приложений. Семейство тем Facebook универсальное — подходит для всех базовых приложений фреймворка Вебасист: Сайт, Блог, Фото, Shop-Script и других. Родительской (основной) темой семейства, включающей в себя базовый набор CSS-стилей и общий макет дизайна index.html, является тема для приложения «Сайт». Все темы Facebook для других приложений (Блог, Фото и других) используют базовый CSS и index.html из родительской (основной) темы.</p>
]]>
    </about>    
</theme>
